{
  "heroAsset": {
    "alt": {
      "en": "A bright blue-and-white surreal 3D creative studio with a computer workstation",
      "zh-CN": "蓝白色超现实 3D 创作工作室与电脑工作台"
    },
    "credit": "Zulian Firmansyah",
    "image": "/images/game-dev-hero.jpg",
    "objectPosition": "center",
    "sourceUrl": "https://unsplash.com/photos/a-minimalist-room-with-a-surreal-background-zFLn5fDZYw0"
  },
  "identity": {
    "email": "jiaxuan.yi@example.com",
    "monogram": "YJX",
    "nameEn": "Jiaxuan Yi",
    "nameZh": "易嘉轩"
  },
  "portfolioContent": {
    "en": {
      "a11y": {
        "backToTop": "Back to top",
        "closeMenu": "Close navigation menu",
        "language": "Choose site language",
        "mobileNav": "Mobile navigation",
        "openMenu": "Open navigation menu",
        "primaryNav": "Primary navigation",
        "projectTags": "Project tags",
        "skip": "Skip to main content"
      },
      "about": {
        "facts": [
          {
            "label": "University",
            "value": "Jiangxi Normal University"
          },
          {
            "label": "Stage",
            "value": "Soon-to-be junior"
          },
          {
            "label": "Current focus",
            "value": "Unreal Engine 5"
          },
          {
            "label": "Target roles",
            "value": "Gameplay Programmer / Technical Designer"
          }
        ],
        "focusIntro": "Every topic should end in a running demo, a clear note, or an honest postmortem.",
        "focusLabel": "CURRENT FOCUS",
        "focusTitle": "From Blueprint prototypes to maintainable gameplay systems",
        "label": "01 / ABOUT",
        "skills": [
          {
            "name": "UE5 & Blueprint",
            "status": "Practicing"
          },
          {
            "name": "C++",
            "status": "Going deeper"
          },
          {
            "name": "Gameplay Framework",
            "status": "Current focus"
          },
          {
            "name": "AI & Animation",
            "status": "Next phase"
          },
          {
            "name": "Performance Profiling",
            "status": "Next phase"
          },
          {
            "name": "Git + LFS",
            "status": "Project foundation"
          }
        ],
        "statement": "At this stage I am not collecting projects for volume. I am building focused, reproducible work that clearly explains the design and technical trade-offs behind it.",
        "title": "Make it playable first. Then make it better."
      },
      "contact": {
        "email": "jiaxuan.yi@example.com",
        "emailLabel": "Email",
        "footerNote": "Studying in Jiangxi, exploring through game worlds.",
        "introduction": "I would love to talk about Unreal Engine, game jams, student projects, and game development internships.",
        "label": "04 / CONTACT",
        "roadmapCta": "View the roadmap",
        "title": "Let us build something playable.",
        "workCta": "View project slots"
      },
      "hero": {
        "availability": "Open to game jams, collaboration, and internships",
        "displayName": "Jiaxuan Yi",
        "eyebrow": "Jiangxi Normal University / Game Development",
        "headline": "Turning ideas into worlds you can play.",
        "introduction": "I am a soon-to-be junior focused on game development. I prototype quickly with Blueprints while progressing into C++, Gameplay Framework, AI, animation, and optimization.",
        "primaryCta": "Explore my work",
        "role": "Game Developer / Learning Unreal Engine 5",
        "secondaryCta": "See my roadmap",
        "secondaryName": "易嘉轩",
        "stageLabel": "Soon-to-be junior",
        "visualLabel": "Unreal Engine environment study"
      },
      "nav": {
        "about": "About",
        "contact": "Contact",
        "roadmap": "Roadmap",
        "work": "Work"
      },
      "projects": [
        {
          "eyebrow": "UE5 Environment / Interaction",
          "id": "ue-environment-study",
          "number": "01",
          "status": "In progress",
          "summary": "Practicing level assembly, materials, lighting, character movement, and basic interactions while documenting visual and performance trade-offs.",
          "tags": [
            "UE5",
            "Blueprint",
            "Level Design"
          ],
          "title": "UE5 Environment & Interaction Study"
        },
        {
          "eyebrow": "Gameplay / Systems",
          "id": "gameplay-prototype",
          "number": "02",
          "status": "Planned",
          "summary": "A focused 5-10 minute prototype built around one core mechanic, covering input, state, UI, and the Gameplay Framework.",
          "tags": [
            "C++",
            "Blueprint",
            "Gameplay"
          ],
          "title": "Gameplay Mechanic Prototype"
        },
        {
          "eyebrow": "Devlog / Breakdown",
          "id": "development-log",
          "number": "03",
          "status": "Ongoing",
          "summary": "Bilingual notes on problems, implementations, profiling data, and postmortems so every study leaves reproducible evidence.",
          "tags": [
            "Devlog",
            "Git + LFS",
            "Profiling"
          ],
          "title": "Development Logs & Technical Breakdowns"
        }
      ],
      "roadmap": {
        "introduction": "Progress is measured by playable outcomes, public documentation, and real feedback - not by the number of tutorials completed.",
        "label": "03 / ROADMAP",
        "stages": [
          {
            "id": "now",
            "number": "01",
            "outcomes": [
              "A 5-10 minute playable demo",
              "Rebuild one Blueprint feature in C++",
              "Git + LFS, README, and four devlogs"
            ],
            "period": "Now",
            "summary": "Finish a small prototype that can be played from beginning to end.",
            "title": "Build the UE5 foundation"
          },
          {
            "id": "six-months",
            "number": "02",
            "outcomes": [
              "A 10-20 minute vertical slice",
              "AI, animation state, and feedback systems",
              "Two game jams with postmortems"
            ],
            "period": "Next 6 months",
            "summary": "Bring systems, presentation, and performance into one playable experience.",
            "title": "Complete a vertical slice"
          },
          {
            "id": "junior-year",
            "number": "03",
            "outcomes": [
              "One public team demo",
              "Flagship project, video, and breakdown",
              "Bilingual resume, mock interviews, and targeted applications"
            ],
            "period": "Junior year",
            "summary": "Show that I can collaborate, ship, and explain my own contribution.",
            "title": "Team delivery & internship prep"
          },
          {
            "id": "graduation",
            "number": "04",
            "outcomes": [
              "Two to three curated projects",
              "Ten playtesters and two feedback iterations",
              "Aligned portfolio, GitHub, resume, and demo reel"
            ],
            "period": "Senior year / Before graduation",
            "summary": "Use a few strong projects to show complete development ability and growth.",
            "title": "Create a job-ready portfolio"
          }
        ],
        "title": "A practical path from now to graduation."
      },
      "seo": {
        "description": "Jiaxuan Yi bilingual game development portfolio, documenting Unreal Engine 5 studies, gameplay prototypes, devlogs, and a practical growth roadmap.",
        "title": "Jiaxuan Yi - Game Development & Unreal Engine Portfolio"
      },
      "work": {
        "imageNotice": "Selected development work",
        "introduction": "Nothing here pretends to be a finished commercial project. Every slot maps to a real learning goal and can expand into a full case study later.",
        "label": "02 / LEARNING & WORK",
        "openSlotLabel": "04 / OPEN SLOT",
        "openSlotMeta": "Ready for a game jam, team project, or focused technical demo",
        "openSlotText": "The data structure is ready. Add a title, status, summary, tags, and screenshots to publish another case study.",
        "openSlotTitle": "Space for the next project",
        "title": "The portfolio will grow with the skills."
      }
    },
    "zh-CN": {
      "a11y": {
        "backToTop": "返回顶部",
        "closeMenu": "关闭导航菜单",
        "language": "选择网站语言",
        "mobileNav": "移动端导航",
        "openMenu": "打开导航菜单",
        "primaryNav": "主要导航",
        "projectTags": "项目标签",
        "skip": "跳到主要内容"
      },
      "about": {
        "facts": [
          {
            "label": "学校",
            "value": "江西师范大学"
          },
          {
            "label": "阶段",
            "value": "即将进入大三"
          },
          {
            "label": "当前重点",
            "value": "Unreal Engine 5"
          },
          {
            "label": "目标方向",
            "value": "Gameplay Programmer / Technical Designer"
          }
        ],
        "focusIntro": "每一个学习主题都要落到一个可运行的 Demo、一次记录或一次复盘。",
        "focusLabel": "当前学习重点",
        "focusTitle": "从 Blueprint 原型到可维护的 Gameplay 系统",
        "label": "01 / 关于我",
        "skills": [
          {
            "name": "UE5 & Blueprint",
            "status": "持续练习"
          },
          {
            "name": "C++",
            "status": "正在深入"
          },
          {
            "name": "Gameplay Framework",
            "status": "当前重点"
          },
          {
            "name": "AI & Animation",
            "status": "下一阶段"
          },
          {
            "name": "Performance Profiling",
            "status": "下一阶段"
          },
          {
            "name": "Git + LFS",
            "status": "项目基础"
          }
        ],